{
  "schemaVersion": 1,
  "id": "20260712T043420Z-51594a8-a3",
  "attempt": 3,
  "sourceCommit": "51594a8b8f460a9b28e1e0ade25816a5a898395b",
  "startedAt": "2026-07-12T04:34:20Z",
  "completedAt": "2026-07-12T04:35:20.495Z",
  "status": "inconclusive",
  "phase": "postflight",
  "failureCode": "FADENO_REVALIDATION_POSTFLIGHT_INCONCLUSIVE"
}
